Accession	Name	Description	ID	CARD Short Name
ARO:3004999	Mycobacterium tuberculosis rpoA mutations confer resistance to rifampicin	Mutations in rpoA that contribute to or confer resistance to rifampicin antibiotic.	43186	Mtub_rpoA_RIF
ARO:3005004	Neisseria gonorrhoeae mtrC with mutation conferring resistance to azithromycin	Mutation in the mtrC efflux pump of Neisseria gonorrhoea shown to confer resistance to azithromycin, a macrolide type antibiotic.	43192	Ngon_mtrC_AZM
ARO:3005006	tet(57)	A tetracycline efflux MFS Transporter from Providencia sp. Y14.	43194	tet(57)
ARO:3005007	QnrVC2	QnrVC2 is a class 1 integron found in Ciprofloxacin-resistant Vibro choleraeO1.	43195	QnrVC2
ARO:3005008	TxR	TxR is a putative transcription regulator that plays a role in conferring tetracycline resistance. It is required for proper functioning of Tet35.	43196	TxR
ARO:3005009	qacE	QacE is a resistance gene conferring resistance to antiseptics.	43197	qacE
ARO:3005010	qacEdelta1	QacEdelta1 is a resistance gene conferring resistance to antiseptics. It is different from QacE only at the 3'-terminus.	43198	qacEdelta1
ARO:3005012	IDC-1	IDC-2 is an IDC beta-lactamase and an integron cephalosprinase.	43200	IDC-1
ARO:3005013	IDC-2	IDC-2 is an IDC beta-lactamase and an integron cephalosprinase.	43202	IDC-2
ARO:3005015	VMB-1	Vibrio metallo-B-lactamase 1, also known as VMB-1, is carbapenemase beta-lactamase that is found in plasmid pVB1796 from Vibrio alginolyticus.	43204	VMB-1
ARO:3005016	CMY-150	CMY-150 is a CMY-2 variant differing by 15 amino-acid substitutions. It confers higher resistance levels to ceftazidime and aztreonam compared to CMY-2.	43207	CMY-150
ARO:3005018	LMB-1	LMB-1 is a subclass B3 metallo-beta-lactamase that confers resistance to penams, cephalosporins, and carbapenems.	43209	LMB-1
ARO:3005019	IMP-68	IMP-68 is a subclass B1 metallo-beta-lactamase that confers resistance to carbapenems.	43210	IMP-68
ARO:3005021	cfr(D)	cfr(D) is found in Enterococcus faecium. It confers resistance to vancomycin, teicoplanin, and linezolid.	43212	cfr(D)
ARO:3005023	cfrE	The gene cfr(E) is a cfr-like gene found in Clostridioides difficile isolate DF11. It confers resistance to antibiotics targeting to the 23s rRNA through hypermethylation of nucleotide A2503.	43214	cfrE
ARO:3005024	FosL1	FosL1 is related to FosA-like genes. It is a plasmid-encoded fosfomycin resistant gene found in E. coli.	43215	FosL1
ARO:3005027	FRI-4	FRI-4 is a carbapenem-hydrolyzing Class A beta-lactamase gene found in Enterobacter asburiae.	43218	FRI-4
ARO:3005028	FRI-5	FRI-5 is a carbapenem-hydrolyzing Class A beta-lactamase gene found in Enterobacter cloacae.	43219	FRI-5
ARO:3005029	FRI-6	FRI-6 is a carbapenem-hydrolyzing Class A beta-lactamase gene found in Enterobacter cloacae.	43221	FRI-6
ARO:3005030	FRI-7	FRI-7 is a carbapenem-hydrolyzing Class A beta-lactamase gene found in Enterobacter asburiae.	43222	FRI-7
ARO:3005031	FRI-8	FRI-8 is a carbapenem-hydrolyzing Class A beta-lactamase gene found in Enterobacter sp. 18A13. It is from a plasmid.	43223	FRI-8
ARO:3005032	FRI-9	FRI-9 is a carbapenem-hydrolyzing Class A beta-lactamase gene found in Enterobacter asburiae.	43225	FRI-9
ARO:3005033	FLC-1	FLC-1 is part of the FRI beta-lactamase family. It is a class A carbapenem-hydrolyzing beta-lactamase from Enterobacter cloacae.	43226	FLC-1
ARO:3005035	Yrc-1	Yrc-1 is a ampC-like beta-lactamase that confers resistance to penams and cephalosporins. It is an ambler class C beta-lactamase.	43233	Yrc-1
ARO:3005036	BLMT	BLMT is a bleomycin (Bm) resistance protein, encoded by the ble gene on the transposon Tn5. This protein confers a survival advantage to Escherichia coli host cells. BLMT confers resistance to bleomycin.	43234	BLMT
ARO:3005037	ADC-159	ADC-159 is an ADC beta-lactamase and a ambler class C beta-lactamase.	43235	ADC-159
ARO:3005038	PDC-65	PDC-65 is an ambler class C beta-lactamase found in Pseudomonas aeruginosa.	43236	PDC-65
ARO:3005039	PDC-55	PDC-55 is an ambler class C beta-lactamase from Pseudomonas aeruginosa.	43237	PDC-55
ARO:3005040	YajC	YajC interacts with the AcrAB-TolC efflux pump in a way that in uncharacterized but is shown to grant increased fitness in the presence of linezolid, rifampicin, and vancomycin.	43238	YajC
ARO:3005041	mlaF	mlaF from the mla system is a gene proposed to play a part in the transport of phospholipids to the outer membrane. Insertions in mlaF are shown to confer resistance to linezolid.	43239	mlaF
ARO:3005042	mlaD	mlaD from the mla system is a gene proposed to play a part in the transport of phospholipids to the outer membrane. Insertions in mlaD are shown to confer resistance to linezolid.	43240	mlaD
ARO:3005043	cmlA9	cmlA9 is a Major Facilitator Superfamily efflux gene that is found in Salmonella enterica.	43241	cmlA9
ARO:3005044	OmpA	OmpA is a porin that confers resistance to beta-lactam antibiotics.	43242	OmpA
ARO:3005045	SatA	SatA is part of the Streptothricin acetyltransferase gene family. It confers resistance to nucleoside antibiotics.	43243	SatA
ARO:3005046	MecC-type methicillin resistance repressor MecI	This MecI is a methicillin-resistant repressor resembling MecC. It confers resistance to penams.	43245	MecI_rep
ARO:3005047	eptB	eptB is a phosphoethanolamine transferase. It confers resistance to peptide antibiotics.	43246	eptB
ARO:3005049	CrcB	CrcB is part of the Camphor Resistance Protein Family. It confers resistance to aminoglycoside antibiotics.	43249	CrcB
ARO:3005051	LpsB	LpsB is involved in lipopolysaccharide synthesis. It confers intrinsic resistance to colistin and other peptide antibiotics.	43252	LpsB
ARO:3005052	LpsA	LpsA plays a role in Lipooligosaccharide biosynthesis. LpsA confers resistance to polymyxin antibiotics.	43253	LpsA
ARO:3005053	ArnT	ArnT is involved in Cell Wall Biosynthesis, specifically 4-amino-4-deoxy-L-arabinose (Ara4N). It confers resistance to peptide antibiotics.	43254	ArnT
ARO:3005056	tet(X6)	Tet(X6) is a tetracycline inactivating enzyme. It is a tet(X) variant.	43257	tet(X6)
ARO:3005057	tet(X5)	Tet(X5) is a tetracycline inactivating enzyme. It is a variant of tet(X).	43259	tet(X5)
ARO:3005059	LptD	LptD is involved in LPS transport in a ABC Transporter efflux system. It confers resistance to rifamycin, aminocoumarin, and peptide antibiotics.	43261	LptD
ARO:3005060	OXA-837	A class D OXA-like beta-lactamase described in the emerging pathogen Cupriavidus gilardii.	43263	OXA-837
ARO:3005061	AAC(3)-IVb	A novel aminoglycoside resistance gene identified from Cupriavidus gilardii; AAC(3)-IVb / aacC10 is an aminoglycoside-3-N-acetyltransferase gene which confers resistance to gentamicin and tobramycin.	43265	AAC(3)-IVb
ARO:3005062	ANT(3'')-Ib	A novel aminoglycoside 3''-adenyltransferase gene and aminoglycoside resistance gene identified from Cupriavidus gilardii. ANT(3'')-Ib / aadA32 confers resistance to spectinomycin and streptomycin.	43266	ANT(3'')-Ib
ARO:3005063	cprR	cprR is one part of a two-component regulatory system. It with its counterpart cprS induce the Arn operon to confer resistance to peptide antibiotics.	43267	cprR
ARO:3005064	cprS	cprS is part of a two-component regulatory system that, with its counterpart cprR, induces the Arn operon in the presence of cationic peptides to confer resistance.	43268	cprS
ARO:3005067	ParS	ParS is the sensor component of the two-component ParRS system. Alongside its counterpart ParR, it confers resistance to polycationic antibiotics though regulation of efflux pumps and porins.	43271	ParS
ARO:3005068	ParR	ParR is a component of the two-component sensor ParRS. Alongside its counterpart ParS, it confers resistance to polycationic antibiotics through the regulation of efflux components and porins.	43272	ParR
ARO:3005069	rsmA	rsmA is a gene that regulates virulence of Pseudomonas aeruginosa. However, its negative effect on MexEF-OprN overexpression has been noted to confer resistance to various antibiotics. It's Escherichia coli homolog is csrA.	43273	rsmA
ARO:3005072	ROB-13	ROB-13 is a beta-lactamase from the blaROB AMR gene family. It was found in Bibersteinia trehalosi.	43276	ROB-13
ARO:3005073	ROB-3	ROB-3 is a beta-lactamase from the blaROB AMR gene family. It was found in Moraxella pluranimalium.	43278	ROB-3
ARO:3005074	ROB-4	ROB-4 is a beta-lactamase from the blaROB AMR gene family. It was found in Moraxella porci.	43279	ROB-4
ARO:3005075	ROB-5	ROB-5 is a class A beta-lactamase from the blaROB AMR gene family. It was found in Moraxella sp. RCAD0137.	43281	ROB-5
ARO:3005076	ROB-6	ROB-6 is a class A beta-lactamase from the blaROB AMR gene family. It was first described by Clemente et al.	43283	ROB-6
ARO:3005077	ROB-7	ROB-7 is a class A beta-lactamase from the blaROB AMR gene family. It was first described by Clemente et al.	43284	ROB-7
ARO:3005078	ROB-8	ROB-8 is a class A beta-lactamase from the blaROB AMR gene family. It was first described by Clemente et al.	43285	ROB-8
ARO:3005079	ROB-2	ROB-2 is an extended spectrum class A beta-lactamase from the blaROB AMR gene family It is described by Kadlec et al.	43286	ROB-2
ARO:3005080	ROB-10	ROB-10 is a class A beta-lactamase from the blaROB AMR gene family. It was found in Glaesserella parasuis.	43287	ROB-10
ARO:3005081	Thermus thermophilus uL3 mutations conferring resistance to pleuromutilin antibiotics	Thermus thermophilus ribosomal protein uL3 containing various mutations conferring resistance to tiamulin. Mutations in the ribosomal protein of uL3 acts by interfering with local rRNA conformation thus conferring resistance.	43289	Tthe_uL3_PLM
ARO:3005083	Thermus thermophilus 23s rRNA conferring resistance to pleuromutilin antibiotics	Mutations in the 23s rRNA of Thermus thermophilus confers resistance to pleuromutilin antibiotics such as tiamulin.	43292	Tthe_23S_PLM
ARO:3005084	dfrA31	dfrA31 is an antibiotic resistance dihydrofolate reductase from an integron found from Vibrio cholerae.	43294	dfrA31
ARO:3005085	AAC(3)-IIg	AAC(3)-IIg is part of the AAC(3) family. It was initially found in clinical isolates of Enterobacter cloacae.	43296	AAC(3)-IIg
ARO:3005087	msrF	msrF is an ABC-F binding cassette ribosomal protection protein. It confers resistance to macrolide antibiotics.	43298	msrF
ARO:3005088	msrH	msrH is a ABC-F binding cassette ribosomal protection protein. It confers resistance to macrolide antibiotics.	43300	msrH
ARO:3005089	mef(D)	mef(D) is a major facilitator superfamily efflux pump protein. It works together with the msr proteins to confer resistance to macrolide antibiotics.	43301	mef(D)
ARO:3005090	RanB	RanB is the determinant of antibiotic resistance within the RanARanB ABC-type efflux system. It confers resistance to aminoglycoside antibiotics.	43302	RanB
ARO:3005091	RanA	RanA is a part of the RanARanB ABC-type efflux system. Alongside RanB, it confers resistance to aminoglycoside antibiotics.	43304	RanA
ARO:3005093	OXA-899	OXA-899 is a class D beta-lactamase and part of the OXA family. It confers resistance to B-lactams and was originally found in Ralstonia pikettii.	43306	OXA-899
ARO:3005094	OXA-898	OXA-898 is a class D beta-lactamase from the OXA family. It confers resistance to B-lactams and was originally found in Ralstonia pikettii.	43307	OXA-898
ARO:3005096	GPC-1	GPC-1 is a class A beta-lactamase. It is part of the GPC beta-lactamase gene family. Originally found in Pseudomonas aeruginosa. Confers resistance to B-lactams.	43309	GPC-1
ARO:3005097	mecC-type BlaZ	A blaZ-like beta-lactamase found in S. Aureus.	43312	mecC-type_BlaZ
ARO:3005098	qacL	A subunit of the qac multidrug efflux pump in Vibrio cholerae.	43313	qacL
ARO:3005099	23S rRNA (adenine(2058)-N(6))-methyltransferase Erm(A)	Variant of ErmA (ARO:3000347) found in Streptococcus pyogenes. Confers the MLSb phenotype.	43314	Spyo_ErmA_MLSb
ARO:3005100	FosB2	Subtype of FosB (ARO:3000172). Present in multiple species.	43315	FosB2
ARO:3005102	Mycobacterium tuberculosis katG mutations conferring resistance to prothionamide	Mutations in Mycobacterium tuberculosis katG conferring resistance to prothionamide, an analogue of isoniazid.	43317	Mtub_katG_PTO
ARO:3005105	Mycobacterium tuberculosis ethA mutations conferring resistance to isoniazid	Mutations in Mycobacterium tuberculosis ethA conferring resistance to isoniazid.	43320	Mtub_ethA_INH
ARO:3005106	Mycobacterium tuberculosis ethA mutations conferring resistance to prothionamide	Mutations in Mycobacterium tuberculosis ethA conferring resistance to prothionamide, an analogue to isoniazid.	43321	Mtub_ethA_PTO
ARO:3005108	Mycobacterium tuberculosis mshA mutations conferring resistance to prothionamide	Mutations in Mycobacterium tuberculosis mshA conferring resistance to prothionamide, an analogue to isoniazid.	43323	Mtub_mshA_PTO
ARO:3005111	blaS1	Predominant beta-lactamase in Mycolicibacterium smegmatis.	43326	blaS1
ARO:3005112	AAC(6')-Ib-cr3	A fluoroquinolone-acetylating aminoglycoside acetyltransferase variant identified from Aeromonas. These proteins confer resistance to both fluoroquinolone and aminoglycoside antibiotics.	43327	AAC(6')-Ib-cr3
ARO:3005114	AAC(6')-Ib-cr4	A fluoroquinolone-acetylating aminoglycoside acetyltransferase variant identified from Enterobacter. These proteins confer resistance to both fluoroquinolone and aminoglycoside antibiotics.	43329	AAC(6')-Ib-cr4
ARO:3005115	AAC(6')-Ib-cr5	A fluoroquinolone-acetylating aminoglycoside acetyltransferase variant identified from Pseudomonas. These proteins confer resistance to both fluoroquinolone and aminoglycoside antibiotics.	43331	AAC(6')-Ib-cr5
ARO:3005116	AAC(6')-Ib-cr6	A fluoroquinolone-acetylating aminoglycoside acetyltransferase variant identified from Escherichia coli. These proteins confer resistance to both fluoroquinolone and aminoglycoside antibiotics.	43332	AAC(6')-Ib-cr6
ARO:3005117	AAC(6')-Ib-cr7	A fluoroquinolone-acetylating aminoglycoside acetyltransferase variant identified from Klebsiella. These proteins confer resistance to both fluoroquinolone and aminoglycoside antibiotics.	43333	AAC(6')-Ib-cr7
ARO:3005118	AAC(6')-Ib-cr8	A fluoroquinolone-acetylating aminoglycoside acetyltransferase variant, identified from Salmonella. These variants confers resistance to both aminoglycoside and fluoroquinolone antibiotics.	43334	AAC(6')-Ib-cr8
ARO:3005119	AAC(6')-Ib-cr9	A fluoroquinolone-acetylating aminoglycoside acetyltransferase variant, identified from Serratia. These variants confers resistance to both aminoglycoside and fluoroquinolone antibiotics.	43335	AAC(6')-Ib-cr9
ARO:3005121	lsaD	The lsa(D) gene represents an ABC-F subfamily protein expressed in Lactococcus garvieae. It confers resistance to Streptogramins A, Pleuromutilins and Lincosamides.	43337	lsaD
ARO:3005122	PDC-68	PDC-68 is an ambler class C beta-lactamase found in Pseudomonas aeruginosa.	43339	PDC-68
ARO:3005123	PDC-70	PDC-70 is an ambler class C beta-lactamase found in Pseudomonas aeruginosa.	43340	PDC-70
ARO:3005124	PDC-63	PDC-63 is an ambler class C beta-lactamase found in Pseudomonas aeruginosa.	43341	PDC-63
ARO:3005125	PDC-57	PDC-57 is an ambler class C beta-lactamase found in Pseudomonas aeruginosa.	43342	PDC-57
ARO:3005126	PDC-66	PDC-66 is an ambler class C beta-lactamase found in Pseudomonas aeruginosa.	43343	PDC-66
ARO:3005127	PDC-14	PDC-14 is an ambler class C beta-lactamase found in Pseudomonas aeruginosa.	43344	PDC-14
ARO:3005128	PDC-47	PDC-47 is an ambler class C beta-lactamase found in Pseudomonas aeruginosa.	43345	PDC-47
ARO:3005129	PDC-51	PDC-51 is an ambler class C beta-lactamase found in Pseudomonas aeruginosa.	43346	PDC-51
ARO:3005130	OXA-846	OXA-846 is a class D beta-lactamase found in Pseudomonas aeruginosa. It is part of the OXA-50 family of oxacillin-hydrolyzing beta-lactamase.	43347	OXA-846
ARO:3005131	NDM-29	An NDM metallo-beta-lactamase variant reported in Klebsiella pneumoniae. Sourced from NCBI's Pathogen Reference Gene Browser; no peer-reviewed article.	43348	NDM-29
ARO:3005132	PDC-11	PDC-11 is an ambler class C beta-lactamase found in Pseudomonas aeruginosa.	43349	PDC-11
ARO:3005133	PDC-62	PDC-62 is an ambler class C beta-lactamase found in Pseudomonas aeruginosa.	43350	PDC-62
ARO:3005134	PDC-43	PDC-43 is an ambler class C beta-lactamase found in Pseudomonas aeruginosa.	43351	PDC-43
ARO:3005135	PDC-54	PDC-54 is an ambler class C beta-lactamase found in Pseudomonas aeruginosa.	43352	PDC-54
ARO:3005136	OXA-906	OXA-906 is a class D beta-lactamase from the OXA-50 family found in Pseudomonas aeruginosa.	43353	OXA-906
ARO:3005137	PDC-59	PDC-59 is an ambler class C beta-lactamase found in Pseudomonas aeruginosa.	43354	PDC-59
ARO:3005138	OXA-850	Pseudomonas aeruginosa strain OXA-50 family oxacillin-hydrolyzing class D beta-lactamase.	43355	OXA-850
ARO:3005139	PDC-67	PDC-67 is an ambler class C beta-lactamase found in Pseudomonas aeruginosa strain 5065.	43356	PDC-67
ARO:3005140	PDC-56	PDC-56 is an ambler class C beta-lactamase found in Pseudomonas aeruginosa strain 4883.	43357	PDC-56
ARO:3005141	PDC-52	PDC-52 is an ambler class C beta-lactamase found in Pseudomonas aeruginosa.	43358	PDC-52
ARO:3005142	PDC-44	PDC-44 is an ambler class C beta-lactamase found in Pseudomonas aeruginosa.	43359	PDC-44
ARO:3005143	PDC-240	PDC-240 is an ambler class C beta-lactamase found in Pseudomonas aeruginosa.	43360	PDC-240
ARO:3005144	PDC-61	PDC-61 is an ambler class C beta-lactamase found in Pseudomonas aeruginosa.	43361	PDC-61
ARO:3005145	PDC-45	PDC-45 is an ambler class C beta-lactamase found in Pseudomonas aeruginosa.	43362	PDC-45
ARO:3005146	PDC-49	PDC-49 is an ambler class C beta-lactamase found in Pseudomonas aeruginosa.	43363	PDC-49
ARO:3005147	PDC-50	PDC-50 is an ambler class C beta-lactamase found in Pseudomonas aeruginosa.	43364	PDC-50
ARO:3005148	PDC-48	PDC-48 is an ambler class C beta-lactamase found in Pseudomonas aeruginosa.	43365	PDC-48
ARO:3005150	PAC-1	PAC-1 is an ambler class C beta-lactamase from the PAC beta-lactamase family. It is found in Pseudomonas aeruginosa.	43367	PAC-1
ARO:3005151	PDC-53	PDC-53 is an ambler class C beta-lactamase found in Pseudomonas aeruginosa.	43368	PDC-53
ARO:3005152	PDC-72	PDC-72 is an ambler class C beta-lactamase found in Pseudomonas aeruginosa.	43369	PDC-72
ARO:3005153	PDC-69	PDC-69 is an ambler class C beta-lactamase found in Pseudomonas aeruginosa.	43370	PDC-69
ARO:3005155	PDC-23	PDC-23 is an ambler class C beta-lactamase found in Pseudomonas aeruginosa.	43372	PDC-23
ARO:3005156	PDC-28	PDC-28 is an ambler class C beta-lactamase found in Pseudomonas aeruginosa.	43373	PDC-28
ARO:3005157	PDC-41	PDC-41 is an ambler class C beta-lactamase found in Pseudomonas aeruginosa.	43374	PDC-41
ARO:3005158	OXA-668	OXA-668 is a class D beta-lactamase from the OXA-274 family of OXA beta-lactamases.	43375	OXA-668
ARO:3005159	OXA-818	OXA-818 is a class D beta-lactamase from the OXA-23 family of OXA beta-lactamases.	43377	OXA-818
ARO:3005160	OXA-812	OXA-812 is a class D beta-lactamase from the OXA-23 family of OXA beta-lactamases.	43378	OXA-812
ARO:3005162	FosA7.5	FosA7.5 is a variant of the FosA7 gene. This gene is unique from FosA7 in that it is found in Escherichia coli as opposed to Salmonella enterica. It confers resistance to fosfomycin.	43514	FosA7.5
ARO:3005164	dfrA35	dfrA35 is a trimethoprim resistant dihydrofolate reductase gene found in the lncC plasmid pEc158 from E.coli.	43516	dfrA35
ARO:3005166	tet(X1)	Tetracycline resistance gene tet(X) ortholog described by Fang et al. 2020.	43518	tet(X1)
ARO:3005176	CMY-158	CMY-158 is a beta-lactamase found in Escherichia coli. It confers resistance to cephamycin. Detected directly from NCBI and submitted without publication on 06-NOV-2018.	43529	CMY-158
ARO:3005177	CMY-173	CMY-173 is a beta-lactamase found in Escherichia coli. It confers resistance to cephamycin. Detected directly from NCBI and submitted without publication on 23-SEP-2020.	43530	CMY-173
ARO:3005178	Mycobacterium tuberculosis ethA mutations conferring resistance to perchlozone	Mutations in ethA conferring resistance to perchlozone, a novel thiosemicarbazone.	43531	Mtub_ethA_PCL
ARO:3005180	CMY-147	CMY-147 is a beta-lactamase found in Escherichia coli. It confers resistance to cephamycin. Detected directly from NCBI and submitted without publication on 23-FEB-2017.	43533	CMY-147
ARO:3005181	CMY-146	CMY-146 is a beta-lactamase found in Escherichia coli. It confers resistance to cephamycin. Detected directly from NCBI and submitted without publication on 18-JAN-2017.	43534	CMY-146
ARO:3005182	CMY-156	CMY-156 is a beta-lactamase found in Escherichia coli. It confers resistance to cephamycin. Detected directly from NCBI and submitted without publication on 14-FEB-2018.	43535	CMY-156
ARO:3005183	CMY-160	CMY-160 is a beta-lactamase found in Escherichia coli. It confers resistance to cephamycin. Detected directly from NCBI and submitted without publication on 29-MAY-2018.	43536	CMY-160
ARO:3005184	CMY-162	CMY-162 is a beta-lactamase found in Escherichia coli. It confers resistance to cephamycin. Detected directly from NCBI and submitted without publication on 21-JUN-2018.	43537	CMY-162
ARO:3005185	CMY-140	CMY-140 is a beta-lactamase found in Escherichia coli. It confers resistance to cephamycin. Detected directly from NCBI and submitted without publication on 09-JUN-2018.	43538	CMY-140
ARO:3005186	CMY-164	CMY-164 is a beta-lactamase found in Escherichia coli. It confers resistance to cephamycin. Detected directly from NCBI and submitted without publication on 26-JUN-2019.	43539	CMY-164
ARO:3005187	CMY-161	CMY-161 is a beta-lactamase found in Escherichia coli. It confers resistance to cephamycin. Detected directly from NCBI and submitted without publication on 24-MAY-2018.	43540	CMY-161
ARO:3005188	CMY-165	CMY-165 is a beta-lactamase found in Escherichia coli. It confers resistance to cephamycin. Detected directly from NCBI and submitted without publication on 23-AUG-2019.	43541	CMY-165
ARO:3005189	CMY-166	CMY-166 is a beta-lactamase found in Escherichia coli. It confers resistance to cephamycin. Detected directly from NCBI and submitted without publication on 23-AUG-2019.	43542	CMY-166
ARO:3005190	CMY-149	CMY-149 is a beta-lactamase found in Proteus mirabilis. It confers resistance to cephamycin. Detected directly from NCBI and submitted without publication on 01-MAY-2017.	43543	CMY-149
ARO:3005191	CMY-139	CMY-139 is a beta-lactamase found in Escherichia coli. It confers resistance to cephamycin. Detected directly from NCBI and submitted without publication on 07-JUN-2016.	43544	CMY-139
ARO:3005192	CMY-148	CMY-148 is a beta-lactamase found in Escherichia coli. It confers resistance to cephamycin. Detected directly from NCBI and submitted without publication on 01-MAY-2017.	43545	CMY-148
ARO:3005193	CMY-163	CMY-163 is a beta-lactamase found in Escherichia coli. It confers resistance to cephamycin. Detected directly from NCBI and submitted without publication on 25-JUN-2018.	43546	CMY-163
ARO:3005194	CMY-154	CMY-154 is a beta-lactamase found in Escherichia coli. It confers resistance to cephamycin. Detected directly from NCBI and submitted without publication on 21-JUN-2017.	43547	CMY-154
ARO:3005195	CMY-142	CMY-142 is a beta-lactamase found in Escherichia coli. It confers resistance to cephamycin. Detected directly from NCBI and submitted without publication on 05-JUN-2016.	43548	CMY-142
ARO:3005196	CMY-141	CMY-141 is a beta-lactamase found in Escherichia coli. It confers resistance to cephamycin. Detected directly from NCBI and submitted without publication on 09-JUN-2018.	43549	CMY-141
ARO:3005197	CMY-145	CMY-145 is a beta-lactamase found in Escherichia coli. It confers resistance to cephamycin. Detected directly from NCBI and submitted without publication on 18-JAN-2017.	43551	CMY-145
ARO:3005198	CMY-157	CMY-96 is a beta-lactamase found in Citrobacter sp. It confers resistance to cephamycin. Detected directly from NCBI and submitted without publication on 09-NOV-2018.	43552	CMY-157
ARO:3005199	CMY-171	CMY-171 is a beta-lactamase found in Escherichia coli. It confers resistance to cephamycin. Detected directly from NCBI and submitted without publication on 14-APR-2020.	43554	CMY-171
ARO:3005200	CMY-155	CMY-155 is a beta-lactamase found in Klebsiella sp. KF07. It confers resistance to cephamycin. Detected directly from NCBI and submitted without publication on 01-AUG-2017.	43555	CMY-155
ARO:3005204	CMY-143	CMY-143 is a beta-lactamase found in Escherichia coli. It confers resistance to cephamycin. Detected directly from NCBI and submitted without publication on 16-NOV-2016.	43560	CMY-143
ARO:3005207	SHV-205	A beta-lactamase gene found in Klebsiella pneumoniae. Directly submitted to NCBI without publication on 07-Nov-2018.	43563	SHV-205
ARO:3005208	SHV-222	A beta-lactamase gene from Klebsiella pneumoniae. Submitted directly to NCBI without publication on 07-NOV-2018.	43564	SHV-222
ARO:3005209	SHV-198	A beta-lactamase gene from Klebsiella pneumoniae. Submitted directly to NCBI without publication on 10-AGU-2017.	43565	SHV-198
ARO:3005210	SHV-195	Beta-lactamase gene from Klebsiella pneumoniae. Directly submitted to NCBI without publication.	43566	SHV-195
ARO:3005211	SHV-201	Beta-lactamase gene from Klebsiella pneumoniae. Directly submitted to NCBI without publication.	43567	SHV-201
ARO:3005212	SHV-212	A beta-lactamase gene from Klebsiella pneumoniae. Directly submitted to NCBI without publication on 07-NOV-2018.	43568	SHV-212
ARO:3005213	SHV-204	A beta-lactamase gene from Klebsiella pneumoniae. Submitted directly to NCBI without publication on 26-JUN-2018.	43569	SHV-204
ARO:3005214	SHV-197	A beta-lactamase gene from Escherichia coli. Directly submitted to NCBI without publication on 05-JAN-2017.	43570	SHV-197
ARO:3005215	SHV-216	A beta-lactamase gene from Klebsiella pneumoniae. Directly submitted to NCBI without publication on 07-NOV-2018.	43571	SHV-216
ARO:3005216	CMY-152	CMY-152 is a beta-lactamase found in Citrobacter freundii. It confers resistance to cephamycin. Detected directly from NCBI and submitted without publication on 25-APR-2017.	43572	CMY-152
