Accession	Name	Description	ID	CARD Short Name
ARO:3003682	OpmH	OpmH is an outer membrane efflux protein required for triclosan-specific efflux pump function.	40317	OpmH
ARO:3003684	Pseudomonas aeruginosa gyrA conferring resistance to fluoroquinolones	Point mutation of Pseudomonas aeruginosa gyrA resulted in the lowered affinity between fluoroquinolones and gyrA. Thus, conferring resistance.	40319	Paer_gyrA_FLO
ARO:3003685	Pseudomonas aeruginosa parE conferring resistance to fluoroquinolones	Point mutation in Pseudomonas aeruginosa parE resulting in sensitivity to fluoroquinolones (ciprofloxacin). In combination with a gyrase mutation (gyrA or gyrB), it confers a high level of resistance to ciprofloxacin.	40320	Paer_parE_FLO
ARO:3003686	Pseudomonas aeruginosa oprD with mutation conferring resistance to imipenem	oprD is an outer membrane porin which facilitates the uptake of basic amino acids and imipenem in Pseudomonas aeruginosa.	40321	Paer_oprD_IPM
ARO:3003688	PvrR	PvrR is a response regulator that controls the conversion between antibiotic-resistant and antibiotic-susceptible forms of Pseudomonas aeruginosa biofilms through porin deletion/gene absence.	40325	PvrR
ARO:3003689	MCR-1.1	MCR-1 is a plasmid-borne phosphoethanolamine transferase that interferes with binding of colistin to the cell membrane via addition of phosphoethanolamine to lipid A, resulting reduction in negative charge of the cell membrane.	40335	MCR-1.1
ARO:3003691	MexJK-OpmH	MexJK-OpmH is a triclosan efflux protein expressed in the Gram-negative Pseudomonas aeruginosa. MexJ is the membrane fusion protein, MexK is the inner membrane resistance-nodulation-cell division (RND) transporter, and OpmH is the outer membrane efflux protein. MexJK is constitutively expressed in mexL mutants.	40339	MexJK-OpmH
ARO:3003692	MexJ	MexJ is the membrane fusion protein of the MexJK multidrug efflux protein.	40340	MexJ
ARO:3003693	MexK	MexK is the inner membrane resistance-nodulation-cell division (RND) transporter in the MexJK multidrug efflux protein.	40341	MexK
ARO:3003694	MexJK-OprM	MexJK-OprM is a multidrug efflux protein expressed in the Gram-negative Pseudomonas aeruginosa. MexJ is the membrane fusion protein, MexK is the inner membrane resistance-nodulation-cell division (RND) transporter, and OprM is the outer membrane factor protein.	40346	MexJK-OprM
ARO:3003697	MexPQ-OpmE	MexPQ-OpmE multidrug efflux pump expressed in Pseudomonas aeruginosa. MexP is the membrane fusion protein; MexQ is the inner membrane transporter; and OpmE is the outer membrane channel.	40349	MexPQ-OpmE
ARO:3003698	mexP	MexP is the membrane fusion protein of the MexPQ-OpmE multidrug efflux complex.	40350	mexP
ARO:3003699	mexQ	MexQ is the inner membrane transporter of the multidrug efflux pump MexPQ-OpmE.	40351	mexQ
ARO:3003700	opmE	opmE is an outer membrane factor protein that is part of the multidrug efflux pump MexPQ-OpmE.	40352	opmE
ARO:3003702	Pseudomonas aeruginosa gyrA and parC conferring resistance to fluoroquinolones	Point mutation in Pseudomonas aeruginosa parC resulting in fluoroquinolone resistance also requiring a gyrA mutation.	40355	Paer_ParC_FLO
ARO:3003703	MexMN-OprM	MexMN-OprM is a multidrug efflux pump expressed in Pseudomonas aeruginosa. MexM is the membrane fusion protein; MexN is the inner membrane transporter; and OprM is the outer membrane channel.	40357	MexMN-OprM
ARO:3003704	mexM	mexM is the membrane fusion protein of the MexMN-OprM multidrug efflux complex.	40358	mexM
ARO:3003705	mexN	MexN is the inner membrane transporter of the MexMN-OprM multidrug efflux complex.	40359	mexN
ARO:3003709	MexZ	MexZ is a transcriptional regulator that downregulates the mexXY multidrug transporter operon, which confers to aminoglycoside resistance on Pseudomonas aeruginosa.	40363	MexZ
ARO:3003710	MexL	MexL is a specific repressor of mexJK transcription and autoregulates its own expression.	40364	MexL
ARO:3003712	VEB-1b	VEB-1b is a beta-lactamase that is found in Pseudomonas aeruginosa.	40366	VEB-1b
ARO:3003713	VCC-1	VCC-1 is a Class A carbapenemase isolated from Vibrio cholerae and exhibits resistance to penicillins, carbapenems and monobactam antibiotics.	40367	VCC-1
ARO:3003714	PEDO-2	PEDO-2 is a subclass B3 metallo-beta lactamase isolated from Pedobacter borealis exhibiting carbapenem resistance.	40368	PEDO-2
ARO:3003715	PEDO-3	PEDO-3 is a class B1 metallo-beta lactamase isolated from Pedobacter kyungheensis exhibiting resistance to carbapenems.	40369	PEDO-3
ARO:3003716	CPS-1	CPS-1 is a subclass B3 metallo-beta lactamase isolated from Chyseobacterium piscium exhibiting carbapenem resistance.	40370	CPS-1
ARO:3003717	ESP-1	ESP-1 is a subclass B3 metallo-beta lactamase isolated from Epilithonimonas tenax conferring resistance to carbapenems.	40371	ESP-1
ARO:3003718	MSI-1	MSI-1 is a subclass B3 metallo-beta lactamase isolated from Massilia oculi conferring resistance to carbapenems.	40372	MSI-1
ARO:3003719	MSI-OXA	MSI-OXA is an OXA-85-like class D beta lactamase isolated from Massilia oculi.	40373	MSI-OXA
ARO:3003720	SPG-1	SPG-1 is a subclass B3 metallo-beta lactamase isolated from Sphingomonas sp.	40374	SPG-1
ARO:3003722	glycopeptide resistance gene cluster VanI	This inducible cluster confers high resistance to vancomycin and intermediate resistance to teicoplanin. It achieves this through peptidoglycan restructuring with its VanA ligase homologue, VanI, causing the precursurs to end in D-Ala-D-Lac. The cluster uniquely contains murF, the final enzyme in the synthesis of UDP-N-acetylmuramoyl-pentapeptide, the precursor of murein. The VanI gene cluster has been found in chromosomal DNA. Gene orientation: vanSRIWK-murFvanX.	40376	vanI_cluster
ARO:3003723	vanI	VanI is a D-Ala-D-Lac ligase that reduces vancomycin binding affinity, helping to confer vancomycin resistance as part of the VanI resistance gene cluster in Desulfitobacterium spp. and Desulfosporosinus spp.	40377	vanI
ARO:3003724	vanW gene in vanI cluster	Also known as vanWI, is a vanW variant found in the vanI gene cluster.	40380	vanW_in_vanI_cl
ARO:3003725	vanX gene in vanI cluster	Also known as vanXI, is a vanX variant found in the vanI glycopeptide resistance gene cluster. It is a D-Ala-D-Ala dipeptidase.	40381	vanX_in_vanI_cl
ARO:3003726	vanS gene in vanI cluster	Also known as vanSI, is a vanS variant found in the vanI gene cluster; it is a histidine kinase.	40383	vanS_in_vanI_cl
ARO:3003727	vanK gene in vanI cluster	Also known as vanKI, is a peptidoglycan bridge formation protein also known as FemAB that is part of the vanI glycopeptide resistance gene cluster.	40384	vanK_in_vanI_cl
ARO:3003728	vanR gene in vanI cluster	Also known as vanRI, is the regulatory transcriptional activator in the vanSR regulator within the vanI glycopeptide resistance gene cluster.	40385	vanR_in_vanI_cl
ARO:3003729	Staphylococcus aureus ileS with mutation conferring resistance to mupirocin	Point mutations to the isoleucyl-tRNA synthetase (ileS) in Staphylococcus aureus that confer resistance to mupirocin.	40418	Saur_ileS_MUP
ARO:3003730	Bifidobacterium bifidum ileS conferring resistance to mupirocin	Bifidobacteria have an intrinsically resistant form of ileS (isoleucyl-tRNA synthetase) that confers resistance to mupirocin.	40419	Bbif_ileS_MUP
ARO:3003731	fusD	A specific fusidic acid resistance gene conferring intrinsic resistance in the bacteria Staphylococcus saprophyticus. FusD behaves by causing dissociation of EF-G from the ribosome thus counteracting the action of Fusidic acid. It is considered a FusB-type protein.	40386	fusD
ARO:3003733	fusC	FusC is a fusidic acid resistance gene enabling ribosomal translocase EF-G dissociation from the ribosome that has been detected in Staphylococcus aureus and Staphylococcus intermedius. Its mechanism is believed to be similar to fusB due to its high level of sequence homology. It is considered a FusB-type protein.	40388	fusC
ARO:3003735	Staphylococcus aureus fusA with mutation conferring resistance to fusidic acid	The mutations to this gene are involved in altering the translation elongation factor G (EF-G) in association with the ribosome to prevent fusidic acid from binding EF-G and preventing translation.	40390	Saur_fusA_FA
ARO:3003737	Staphylococcus aureus fusE with mutation conferring resistance to fusidic acid	The mutations to the rplF gene encoding riboprotein L6 have been shown to cause fusidic acid resistance, demonstrating a potential secondary site of action of the antibiotic that is blocked through these mutations. Several types of mutations have been identified that cause resistance, including SNPs, frameshift mutations and early stop codons.	40392	Saur_fusE_FA
ARO:3003741	mphE	mphE is a macrolide phosphotransferase and resistance gene identified on a plasmid, pRSB105.	40396	mphE
ARO:3003742	mphG	The mphG gene encodes a macrolide 2'-phosphotransferase found in Photobacterium damselae sharing sequence similarity to mphA in E. coli.	40397	mphG
ARO:3003744	vatF	vatF is a streptogramin A acetyl transferase gene isolated from the chromosome of Yersinia enterocolitica.	40399	vatF
ARO:3003745	mefC	mefC is a macrolide efflux gene isolated from a plasmid in Photobacterium damselae.	40401	mefC
ARO:3003746	optrA	OptrA is a member of the ABC-F protein subfamily that confers resistance to oxazolidinones. The gene encoding the protein was originally isolated from a plasmid in Enterococcus faecalis and Enterococcus faecium.	40402	optrA
ARO:3003748	oleC	oleC is an ABC transporter isolated from Streptomyces antibioticus and is involved in oleandomycin secretion.	40404	oleC
ARO:3003749	salA	salA is an ABC-F subfamily protein gene isolated from the chromosome of Mammaliicoccus sciuri conferring resistance to lincosamides and streptogramins.	40405	salA
ARO:3003751	Escherichia coli nfsA mutations conferring resistance to nitrofurantoin	nfsA encodes the major oxygen-insesitive nitroreductase in E. coli. The first step of resistance to nitrofurazone is mutation of nfsA.	40407	Ecol_nfsA_NIT
ARO:3003756	Escherichia coli nfsB with mutation conferring resistance to nitrofurantoin	nfsB encodes the minor oxygen-insesitive nitroreductase in E. coli. The first step of resistance to nitrofurazone is mutation of nfsA, while the increased resistance associated with second step mutants is a consequence of nfsB mutation.	40413	Ecol_nfsB_NIT
ARO:3003760	Enterococcus faecalis cls with mutation conferring resistance to daptomycin	Cardiolipin synthase (cls) is an inner membrane protein involved in membrane synthesis and phosopholipid metabolism, with mutations to the gene being capable of conferring daptomycin resistance.	40417	Efae_cls_DAP
ARO:3003761	eatAv	eatAv is a mutated form of the wildtype eatA ABC-F subfamily protein isolated from Enterococcus faecium conferring resistance to lincosamides, streptogramin A's and pleuromutilins (LSaP phenotype).	40408	eatAv
ARO:3003762	lnuE	lnuE encodes a lincosamide resistance gene isolated from Streptococcus suis that was truncated by an ISEnfa5-cfr-ISEnfa5 segment insertion. It shares the closest sequence similarity to lnuA.	40400	lnuE
ARO:3003767	mphM	mphM is a chromosomally-encoded macrolide phosphotransferases that inactivate 14-, 15- and 16-membered macrolides.	40436	mphM
ARO:3003769	Staphylococcus aureus mprF	MprF is a integral membrane protein that modifies the negatively-charged phosphatidylglycerol on the membrane surface. A point mutation in the putative mprF synthase domain is associated with enhanced expression, increased synthesis and reduced daptomycin surface binding. This confers resistance to cationic peptides that disrupt the cell membrane, including defensins.	40441	Saur_mprF
ARO:3003770	Listeria monocytogenes mprF	MprF is a integral membrane protein that modifies the negatively-charged phosphatidylglycerol on the membrane surface. This confers resistance to cationic peptides that disrupt the cell membrane, including defensins.	40442	Lmon_mprF
ARO:3003772	Brucella suis mprF	MprF is a integral membrane protein that modifies the negatively-charged phosphatidylglycerol on the membrane surface. This confers resistance to cationic peptides that disrupt the cell membrane, including defensins.	40445	Bsui_mprF
ARO:3003773	Clostridium perfringens mprF	MprF is a integral membrane protein that modifies the negatively-charged phosphatidylglycerol on the membrane surface. This confers resistance to cationic peptides that disrupt the cell membrane, including defensins.	40447	Cper_mprF
ARO:3003774	Streptococcus agalactiae mprF	MprF is a integral membrane protein that modifies the negatively-charged phosphatidylglycerol on the membrane surface. This confers resistance to cationic peptides that disrupt the cell membrane, including defensins.	40449	Saga_mprF
ARO:3003775	Escherichia coli murA with mutation conferring resistance to fosfomycin	murA or UDP-N-acetylglucosamine enolpyruvyl transferase catalyses the initial step in peptidoglycan biosynthesis and is inhibited by fosfomycin. Overexpression of murA through mutations such as Asp369Asn and Leu370Ile confers fosfomycin resistance. Extensive evidence has shown the significance of C115 mutations in conferring fosfomycin resistance since this residue represents a primary binding site for the antibiotic across many species.	40451	Ecol_murA_FOF
ARO:3003776	Staphylococcus aureus murA with mutation conferring resistance to fosfomycin	murA or UDP-N-acetylglucosamine enolpyruvyl transferase catalyses the initial step in peptidoglycan biosynthesis and is inhibited by fosfomycin. Overexpression of murA through mutations confers fosfomycin resistance.	40453	Saur_murA_FOF
ARO:3003777	Borreliella burgdorferi murA with mutation conferring resistance to fosfomycin	murA or UDP-N-acetylglucosamine enolpyruvyl transferase catalyses the initial step in peptidoglycan biosynthesis and is inhibited by fosfomycin. Mutations to the murA enzyme confers resistance to the antibiotic.	40454	Bbur_mur_FOF
ARO:3003778	Mycolicibacterium smegmatis ndh with mutation conferring resistance to isoniazid	Mutations in the Mycolicibacterium smegmatis ndh gene that results in increased resistance to isoniazid.	40460	Msme_ndh_INH
ARO:3003779	Mycobacterium tuberculosis variant bovis ndh with mutation conferring resistance to isoniazid	Mutations in the Mycobacterium tuberculosis variant bovis ndh gene that results in increased resistance to isoniazid.	40461	Mbov_ndh_INH
ARO:3003784	Mycobacterium tuberculosis intrinsic murA conferring resistance to fosfomycin	Mycobacterium tuberculosis murA confers intrinsic resistance to fosfomycin. The presence of an aspartic acid residue in place of the critical cysteine at position 117 that enables fosfomycin binding is believed to be responsible for this intrinsic resistance.	40467	Mtub_murA_FOF
ARO:3003785	Chlamydia trachomatis intrinsic murA conferring resistance to fosfomycin	Chlamydia murA confers intrinsic resistance to fosfomycin. The presence of an aspartic acid residue in place of the critical cysteine at position 119 that enables fosfomycin binding is believed to be responsible for this intrinsic resistance.	40469	Ctra_murA_FOF
ARO:3003788	Bacillus subtilis pgsA with mutation conferring resistance to daptomycin	Point mutations that occur within the Bacillus subtilis pgsA gene resulting in resistance to daptomycin.	40473	Bsub_pgsA_DAP
ARO:3003789	Campylobacter jejuni gyrA conferring resistance to fluoroquinolones	Campylobacter jejuni is a major bacterial infectious agent associated with gastroenteritis. Quinolone resistance is reportedly conferred by a single C-257-T nucleotide substitution in the gyrA gene.	40474	Cjej_gyrA_FLO
ARO:3003790	Enterococcus faecium liaF mutant conferring daptomycin resistance	liaF is an accessory protein that acts as a negative regulator of liaRS signal transduction pathway. Mutations confer daptomycin resistance.	40475	Efac_liaF_DAP
ARO:3003791	Enterococcus faecalis liaS mutant conferring daptomycin resistance	liaS is a histidine kinase found in the liaFSR signal transduction pathway. Mutations confer daptomycin resistance.	40476	Efae_liaS_DAP
ARO:3003792	Enterococcus faecalis liaR mutant conferring daptomycin resistance	liaR is a response regulator found in the liaFSR signal transduction pathway. Mutations confer daptomycin resistance.	40477	Efae_liaR_DAP
ARO:3003793	SPM-1	Plasmid-mediated SPM metallo-beta-lactamase conferring resistance to carbapenem. Originally isolated from Pseudomonas aeruginosa. Responsible for carbapenem-resistant Pseudomonas aeruginosa (CRPA) outbreaks in Brazil.	40478	SPM-1
ARO:3003794	Staphylococcus aureus walK with mutation conferring resistance to daptomycin	walK is the histidine kinase sensor of a two-component regulatory system controlling peptidoglycan metabolism through regulation of the expression of most of the peptidoglycan hydrolase genes. Mutations in the gene have been found that confer daptomycin resistance.	40479	Saur_walK_DAP
ARO:3003796	Acinetobacter baumannii ampC beta-lactamase	A class C beta-lactamase found in Acinetobacter baumannii that confers resistance to piperacillin and cefepime.	40481	Abau_ampC_BLA
ARO:3003797	Enterococcus faecalis YybT with mutation conferring daptomycin resistance	YybT has phosphodiesterase activity towards cyclic dinucleotides using a c-di-GMP hydrolyzing phosphodiesterase domain. Mutations to the gene confer resistance to daptomycin.	40482	Efae_YybT_DAP
ARO:3003800	Enterococcus faecalis gdpD with mutation conferring daptomycin resistance	gdpD is a glycerolphosphodiesterase whose mutations confer resistance to daptomycin.	40485	Efae_gdpD_DAP
ARO:3003801	bcr-1	Transmembrane protein which expels bicyclomycin from the cell, leading to bicyclomycin resistance. Identified in Pseudomonas aeruginosa strains responsible for outbreaks in Brazil, often appearing with blaSPM-1, another bicyclomycin resistance gene.	40486	bcr-1
ARO:3003803	Staphylococcus aureus agrA with mutation conferring resistance to daptomycin	agrA is an autoinducer in a peptide-quorum two-component regulatory system whose mutations confer daptomycin resistance.	40488	Saur_agrA_DAP
ARO:3003805	Enterococcus faecalis gshF with mutation conferring daptomycin resistance	gshF is a bifunctional glutamate-cysteine ligase/ glutathione synthetase that when mutated, confers daptomycin resistance.	40490	Efae_gshF_DAP
ARO:3003807	Escherichia coli AcrAB-TolC with AcrR mutation conferring resistance to ciprofloxacin, tetracycline, and ceftazidime	AcrR is a repressor of the AcrAB-TolC multidrug efflux complex. AcrR mutations result in high level antibiotic resistance. The mutations associated with this model are specific to E. coli.	40492	Ecol_AcrR_MULT
ARO:3003808	carO	carO is a transmembrane beta-barrel involved in the influx of carbapenem antibiotics in Acinetobacter baumannii. Disruption of the carO gene by distinct insertion elements results in a loss of carO expression causing resistance to carbapenem antibiotics. Homologs of carO have been identified in genera Acinetobacter, Moraxella and Psychrobacter.	40493	carO
ARO:3003809	Acinetobacter baumannii OprD conferring resistance to imipenem	An outer member protein (OMP) found in Acinetobacter baumannii involved in the uptake of imipenem and basic amino acids. This porin is homologous to Pseudomonas aeruginosa OprD, which performs an identical function.	40495	Abau_OprD_IPM
ARO:3003811	adeC	AdeC is the outer membrane factor of the AdeABC multidrug efflux complex. It can be replaced by other outer membrane channels, and is not essential for antibiotic resistance.	40499	adeC
ARO:3003813	Enterococcus faecalis drmA with mutation conferring daptomycin resistance	drmA is an uncharacterized 6-pass membrane protein, with mutations to the protein causing modest resistance to daptomycin.	40502	Efae_drmA_DAP
ARO:3003815	Enterococcus faecalis YvlB with mutation conferring daptomycin resistance	YvlB is a putative target of the liaFSR signalling pathway, whose mutations confer daptomycin resistance.	40504	Efae_YvlB_DAP
ARO:3003817	Acinetobacter baumannii gyrA conferring resistance to fluoroquinolones	Mutations in the A subunit of DNA gyrase reduce its affinity for fluoroquinolones, thereby conferring resistance.	40507	Abau_gyrA_FLO
ARO:3003818	Acinetobacter baumannii parC conferring resistance to fluoroquinolones	Mutations in Acinetobacter baumannii parC that result in resistance to fluoroquinolones.	40508	Abau_parC_FLO
ARO:3003820	mgrB	mgrB is a small transmembrane protein produced in the PhoPQ signalling system. It acts as a negative regulator in this system. Inactivation or down-regulation of mgrB confers colistin resistance by absence as shown in Klebsiella pneumoniae.	40510	mgrB
ARO:3003835	cdeA	Clostridioides difficile and Escherichia coli multidrug efflux transporter with antiporter function. Confers resistance to fluoroquinolones in E. coli and acriflavin in Clostridioides difficile.	40526	cdeA
ARO:3003836	qacH	qacH is a subunit of the qac multidrug efflux pump in Staphylococcus saprophyticus.	40527	qacH
ARO:3003838	gadW	GadW is an AraC-family regulator that promotes mdtEF expression to confer multidrug resistance. GadW inhibits GadX-dependent activation. GadW clearly represses gadX and, in situations where GadX is missing, activates gadA and gadBC.	40529	gadW
ARO:3003839	Mrx	Mrx is part of the macrolide inactivation gene cluster in Aeromonas hydrophila.	40531	Mrx
ARO:3003841	kdpE	kdpE is a transcriptional activator that is part of the two-component system KdpD/KdpE that is studied for its regulatory role in potassium transport and has been identified as an adaptive regulator involved in the virulence and intracellular survival of pathogenic bacteria. kdpE regulates a range of virulence loci through direct promoter binding.	40534	kdpE
ARO:3003842	MUS-2	MUS-2 is a chromosome-encoded beta-lactamase from Myroides odoratimimus.	40535	MUS-2
ARO:3003843	leuO	leuO, a LysR family transcription factor, exists in a wide variety of bacteria of the family Enterobacteriaceae and is involved in the regulation of as yet unidentified genes affecting the stress response and pathogenesis expression. LeuO is also an activator of the MdtNOP efflux pump.	40537	leuO
ARO:3003844	mfd	mfd dissociates transcription elongation complexes blocked at nonpairing lesions and mediates recruitment of DNA repair proteins. The Mfd (mutation frequency decline) protein, also known as transcription-repair coupling factor, is responsible for ATP-dependent removal of stalled RNA polymerase from DNA lesions by inducing forward movement of the RNA polymerase and subsequent recruitment of nucleotide excision repair machinery to the sites of the lesions.	40538	mfd
ARO:3003847	ADC-1	ADC-1 is a beta-lactamase found in Acinetobacter baumannii.	40544	ADC-1
ARO:3003848	ADC-2	ADC-2 is a beta-lactamase found in Oligella urethralis.	40545	ADC-2
ARO:3003849	ADC-3	ADC-3 is a beta-lactamase found in Acinetobacter baumannii.	40547	ADC-3
ARO:3003850	ADC-4	ADC-4 is a beta-lactamase found in Acinetobacter baumannii.	40548	ADC-4
ARO:3003851	ADC-5	ADC-5 is a beta-lactamase found in Acinetobacter pittii.	40549	ADC-5
ARO:3003852	ADC-6	ADC-6 is a beta-lactamase found in Acinetobacter baumannii.	40551	ADC-6
ARO:3003853	ADC-7	ADC-7 is a beta-lactamase that is found in Acinetobacter baumannii.	40552	ADC-7
ARO:3003854	ADC-8	ADC-8 is a beta-lactamase found in Acinetobacter sp.	40553	ADC-8
ARO:3003855	ADC-10	ADC-10 is a beta-lactamase found in Acinetobacter baumannii.	40554	ADC-10
ARO:3003856	ADC-12	ADC-12 is a beta-lactamase found in Acinetobacter pittii.	40555	ADC-12
ARO:3003857	ADC-13	ADC-13 is a beta-lactamase found in Acinetobacter pittii.	40556	ADC-13
ARO:3003858	ADC-14	ADC-14 is a beta-lactamase found in Acinetobacter pittii.	40557	ADC-14
ARO:3003859	ADC-15	ADC-15 is a beta-lactamase found in Acinetobacter pittii.	40558	ADC-15
ARO:3003860	ADC-16	ADC-16 is a beta-lactamase found in Acinetobacter pittii.	40559	ADC-16
ARO:3003861	ADC-17	ADC-17 is a beta-lactamase found in Acinetobacter pittii.	40560	ADC-17
ARO:3003862	ADC-18	ADC-18 is a beta-lactamase found in Acinetobacter pittii.	40561	ADC-18
ARO:3003863	ADC-19	ADC-19 is a beta-lactamase found in Acinetobacter pittii.	40562	ADC-19
ARO:3003864	ADC-20	ADC-20 is a beta-lactamase found in Acinetobacter pittii.	40563	ADC-20
ARO:3003865	ADC-21	ADC-21 is a beta-lactamase found in Acinetobacter pittii.	40564	ADC-21
ARO:3003866	ADC-22	ADC-22 is a beta-lactamase found in Acinetobacter pittii.	40565	ADC-22
ARO:3003867	ADC-23	ADC-23 is a beta-lactamase found in Acinetobacter pittii.	40566	ADC-23
ARO:3003868	ADC-25	ADC-25 is a beta-lactamase found in Acinetobacter baumannii.	40567	ADC-25
ARO:3003870	ADC-31	ADC-31 is a beta-lactamase found in Acinetobacter baumannii.	40569	ADC-31
ARO:3003871	ADC-39	ADC-39 is a beta-lactamase found in Acinetobacter baumannii.	40570	ADC-39
ARO:3003872	ADC-41	ADC-41 is a beta-lactamase found in Acinetobacter pittii.	40571	ADC-41
ARO:3003873	ADC-42	ADC-42 is a beta-lactamase found in Acinetobacter pittii.	40572	ADC-42
ARO:3003874	ADC-43	ADC-43 is a beta-lactamase found in Acinetobacter pittii.	40573	ADC-43
ARO:3003876	ADC-44	ADC-44 is a beta-lactamase found in Acinetobacter pittii.	40575	ADC-44
ARO:3003878	ADC-56	ADC-56 is a beta-lactamase found in Acinetobacter baumannii.	40577	ADC-56
ARO:3003879	ADC-61	ADC-61 is a beta-lactamase found in Acinetobacter baumannii.	40578	ADC-61
ARO:3003880	ADC-74	ADC-74 is a beta-lactamase found in Acinetobacter baumannii.	40579	ADC-74
ARO:3003881	ADC-75	ADC-75 is a beta-lactamase found in Acinetobacter baumannii.	40580	ADC-75
ARO:3003882	ADC-76	ADC-76 is a beta-lactamase found in Acinetobacter baumannii.	40581	ADC-76
ARO:3003883	ADC-77	ADC-77 is a beta-lactamase found in Acinetobacter baumannii.	40582	ADC-77
ARO:3003884	ADC-78	ADC-78 is a beta-lactamase found in Acinetobacter baumannii.	40583	ADC-78
ARO:3003885	ADC-79	ADC-79 is a beta-lactamase found in Acinetobacter baumannii.	40584	ADC-79
