Accession	Name	Description	ID	CARD Short Name
ARO:3002196	IMP-5	IMP-5 is a beta-lactamase found in Acinetobacter baumannii.	38596	IMP-5
ARO:3002197	IMP-6	IMP-6 is a beta-lactamase found in Serratia marcescens.	38597	IMP-6
ARO:3002198	IMP-7	IMP-7 is a beta-lactamase found in Pseudomonas aeruginosa.	38598	IMP-7
ARO:3002199	IMP-8	IMP-8 is a beta-lactamase found in Klebsiella pneumoniae.	38599	IMP-8
ARO:3002200	IMP-9	IMP-9 is a beta-lactamase found in Pseudomonas aeruginosa.	38600	IMP-9
ARO:3002201	IMP-10	IMP-10 is a beta-lactamase found in Pseudomonas aeruginosa.	38601	IMP-10
ARO:3002202	IMP-11	IMP-11 is a beta-lactamase found in Pseudomonas and Acinetobacter spp.	38602	IMP-11
ARO:3002203	IMP-12	IMP-12 is a beta-lactamase found in Pseudomonas putida.	38603	IMP-12
ARO:3002204	IMP-13	IMP-13 is a beta-lactamase found in Pseudomonas aeruginosa.	38604	IMP-13
ARO:3002205	IMP-14	IMP-14 is a beta-lactamase found in Pseudomonas and Acinetobacter spp.	38605	IMP-14
ARO:3002206	IMP-15	IMP-15 is a beta-lactamase found in Pseudomonas aeruginosa.	38606	IMP-15
ARO:3002207	IMP-16	IMP-16 is a beta-lactamase found in Pseudomonas aeruginosa.	38607	IMP-16
ARO:3002208	IMP-17	IMP-17 is a beta-lactamase. From the Lahey list of IMP beta-lactamases.	38608	IMP-17
ARO:3002209	IMP-18	IMP-18 is a beta-lactamase found in Pseudomonas aeruginosa.	38609	IMP-18
ARO:3002210	IMP-19	IMP-19 is a beta-lactamase found in Aeromonas caviae.	38610	IMP-19
ARO:3002211	IMP-20	IMP-20 is a beta-lactamase found in Pseudomonas and Acinetobacter spp.	38611	IMP-20
ARO:3002212	IMP-21	IMP-21 is a beta-lactamase found in Pseudomonas and Acinetobacter spp.	38612	IMP-21
ARO:3002213	IMP-22	IMP-22 is a beta-lactamase found in Pseudomonas spp.	38613	IMP-22
ARO:3002214	IMP-23	IMP-23 is a beta-lactamase. From the Lahey list of IMP beta-lactamases.	38614	IMP-23
ARO:3002215	IMP-24	IMP-24 is a beta-lactamase found in Pseudomonas aeruginosa.	38615	IMP-24
ARO:3002216	IMP-25	IMP-25 is a beta-lactamase found in Serratia marcescens.	38616	IMP-25
ARO:3002217	IMP-26	IMP-26 is a beta-lactamase found in Pseudomonas aeruginosa.	38617	IMP-26
ARO:3002218	IMP-27	IMP-27 is a beta-lactamase. From the Lahey list of IMP beta-lactamases.	38618	IMP-27
ARO:3002219	IMP-28	IMP-28 is a beta-lactamase found in Klebsiella oxytoca.	38619	IMP-28
ARO:3002220	IMP-29	IMP-29 is a beta-lactamase found in Pseudomonas aeruginosa.	38620	IMP-29
ARO:3002221	IMP-30	IMP-30 is a beta-lactamase found in Pseudomonas aeruginosa.	38621	IMP-30
ARO:3002222	IMP-31	IMP-31 is a beta-lactamase. From the Lahey list of IMP beta-lactamases.	38622	IMP-31
ARO:3002223	IMP-32	IMP-32 is a beta-lactamase. From the Lahey list of IMP beta-lactamases.	38623	IMP-32
ARO:3002224	IMP-33	IMP-33 is a beta-lactamase found in Pseudomonas aeruginosa.	38624	IMP-33
ARO:3002225	IMP-34	IMP-34 is a beta-lactamase found in Klebsiella spp.	38625	IMP-34
ARO:3002226	IMP-35	IMP-35 is a beta-lactamase found in Pseudomonas aeruginosa.	38626	IMP-35
ARO:3002228	IMP-37	IMP-37 is a beta-lactamase. From the Lahey list of IMP beta-lactamases.	38628	IMP-37
ARO:3002229	IMP-38	IMP-38 is a beta-lactamase. From the Lahey list of IMP beta-lactamases.	38629	IMP-38
ARO:3002230	IMP-39	IMP-39 is a beta-lactamase. From the Lahey list of IMP beta-lactamases.	38630	IMP-39
ARO:3002231	IMP-40	IMP-40 is a beta-lactamase found in Pseudomonas and Acinetobacter spp.	38631	IMP-40
ARO:3002232	IMP-41	IMP-41 is a beta-lactamase found in Pseudomonas and Acinetobacter spp.	38632	IMP-41
ARO:3002233	IMP-42	IMP-42 is a beta-lactamase found in Pseudomonas and Acinetobacter spp.	38633	IMP-42
ARO:3002234	IMP-43	IMP-43 is a beta-lactamase found in Pseudomonas aeruginosa.	38634	IMP-43
ARO:3002235	IMP-44	IMP-44 is a beta-lactamase found in Pseudomonas aeruginosa.	38635	IMP-44
ARO:3002236	IMP-45	IMP-45 is a beta-lactamase found in Pseudomonas aeruginosa.	38636	IMP-45
ARO:3002237	IMP-46	IMP-46 is a beta-lactamase. From the Lahey list of IMP beta-lactamases.	38637	IMP-46
ARO:3002239	IMP-48	IMP-48 is a beta-lactamase. From the Lahey list of IMP beta-lactamases.	38639	IMP-48
ARO:3002240	CARB-1	CARB-1 is a beta-lactamase found in Pseudomonas aeruginosa.	38640	CARB-1
ARO:3002241	CARB-2	CARB-2 is a beta-lactamase found in Pseudomonas aeruginosa.	38641	CARB-2
ARO:3002242	CARB-3	CARB-3 is a beta-lactamase found in Pseudomonas aeruginosa.	38642	CARB-3
ARO:3002243	CARB-4	CARB-4 is a beta-lactamase found in Pseudomonas aeruginosa.	38643	CARB-4
ARO:3002244	CARB-5	CARB-5 is a beta-lactamase found in Acinetobacter calcoaceticus.	38644	CARB-5
ARO:3002245	CARB-6	CARB-6 is a beta-lactamase found in Vibrio cholerae.	38645	CARB-6
ARO:3002246	CARB-7	CARB-7 is a beta-lactamase found in Vibrio cholerae.	38646	CARB-7
ARO:3002247	CARB-8	CARB-8 is a beta-lactamase found in Oligella urethralis.	38647	CARB-8
ARO:3002248	CARB-9	CARB-9 is a beta-lactamase found in Vibrio cholerae.	38648	CARB-9
ARO:3002249	CARB-10	CARB-10 is a beta-lactamase found in Acinetobacter baumannii.	38649	CARB-10
ARO:3002250	CARB-12	CARB-12 is a beta-lactamase. From the Lahey list of IMP beta-lactamases.	38650	CARB-12
ARO:3002252	CARB-14	CARB-14 is a beta-lactamase found in Acinetobacter baumannii.	38652	CARB-14
ARO:3002254	CARB-17	CARB-17 is a beta-lactamase. From the Lahey list of IMP beta-lactamases.	38654	CARB-17
ARO:3002255	CARB-16	CARB-16 is a beta-lactamase. From the Lahey list of IMP beta-lactamases.	38655	CARB-16
ARO:3002256	IND-1	IND-1 is a beta-lactamase found in Chryseobacterium indologenes.	38656	IND-1
ARO:3002257	IND-2	IND-2 is a beta-lactamase found in Chryseobacterium indologenes.	38657	IND-2
ARO:3002258	IND-2a	IND-2a is a beta-lactamase found in Chryseobacterium indologenes.	38658	IND-2a
ARO:3002259	IND-3	IND-3 is a beta-lactamase found in Chryseobacterium indologenes.	38659	IND-3
ARO:3002260	IND-4	IND-4 is a beta-lactamase found in Chryseobacterium indologenes.	38660	IND-4
ARO:3002261	IND-5	IND-5 is a beta-lactamase found in Chryseobacterium indologenes.	38661	IND-5
ARO:3002262	IND-6	IND-6 is a beta-lactamase found in Chryseobacterium indologenes.	38662	IND-6
ARO:3002263	IND-7	IND-7 is a beta-lactamase found in Chryseobacterium indologenes.	38663	IND-7
ARO:3002264	IND-8	IND-8 is a beta-lactamase found in Escherichia coli.	38664	IND-8
ARO:3002265	IND-9	IND-9 is a beta-lactamase found in Escherichia coli.	38665	IND-9
ARO:3002266	IND-10	IND-10 is a beta-lactamase found in Escherichia coli.	38666	IND-10
ARO:3002267	IND-11	IND-11 is a beta-lactamase found in Escherichia coli.	38667	IND-11
ARO:3002268	IND-12	IND-12 is a beta-lactamase found in Escherichia coli.	38668	IND-12
ARO:3002269	IND-14	IND-14 is a beta-lactamase found in Escherichia coli.	38669	IND-14
ARO:3002270	IND-15	IND-15 is a beta-lactamase found in Escherichia coli.	38670	IND-15
ARO:3002271	VIM-1	VIM-1 is a beta-lactamase found in Pseudomonas spp.	38671	VIM-1
ARO:3002272	VIM-2	VIM-2 is a beta-lactamase found in Pseudomonas spp.	38672	VIM-2
ARO:3002273	VIM-3	VIM-3 is a beta-lactamase found in Pseudomonas spp.	38673	VIM-3
ARO:3002274	VIM-4	VIM-4 is a beta-lactamase found in Pseudomonas aeruginosa.	38674	VIM-4
ARO:3002275	VIM-5	VIM-5 is a beta-lactamase found in Pseudomonas aeruginosa.	38675	VIM-5
ARO:3002276	VIM-6	VIM-6 is a beta-lactamase found in Pseudomonas spp.	38676	VIM-6
ARO:3002277	VIM-7	VIM-7 is a beta-lactamase found in Pseudomonas aeruginosa.	38677	VIM-7
ARO:3002278	VIM-8	VIM-8 is a beta-lactamase found in Pseudomonas aeruginosa.	38678	VIM-8
ARO:3002279	VIM-9	VIM-9 is a beta-lactamase found in Pseudomonas spp.	38679	VIM-9
ARO:3002280	VIM-10	VIM-10 is a beta-lactamase found in Pseudomonas spp.	38680	VIM-10
ARO:3002281	VIM-11	VIM-11 is a beta-lactamase found in Pseudomonas aeruginosa.	38681	VIM-11
ARO:3002282	VIM-12	VIM-12 is a beta-lactamase found in Klebsiella pneumoniae.	38682	VIM-12
ARO:3002283	VIM-13	VIM-13 is a beta-lactamase found in Pseudomonas aeruginosa.	38683	VIM-13
ARO:3002284	VIM-14	VIM-14 is a beta-lactamase found in Pseudomonas aeruginosa.	38684	VIM-14
ARO:3002285	VIM-15	VIM-15 is a beta-lactamase found in Pseudomonas aeruginosa.	38685	VIM-15
ARO:3002286	VIM-16	VIM-16 is a beta-lactamase found in Pseudomonas aeruginosa.	38686	VIM-16
ARO:3002287	VIM-17	VIM-17 is a beta-lactamase found in Pseudomonas aeruginosa.	38687	VIM-17
ARO:3002288	VIM-18	VIM-18 is a beta-lactamase found in Pseudomonas aeruginosa.	38688	VIM-18
ARO:3002289	VIM-19	VIM-19 is a beta-lactamase found in the Enterobacteriaceae family.	38689	VIM-19
ARO:3002290	VIM-20	VIM-20 is a beta-lactamase. From the Lahey list of VIM beta-lactamases.	38690	VIM-20
ARO:3002293	VIM-23	VIM-23 is a beta-lactamase found in Enterobacter cloacae.	38693	VIM-23
ARO:3002294	VIM-24	VIM-24 is a beta-lactamase found in Klebsiella pneumoniae.	38694	VIM-24
ARO:3002295	VIM-25	VIM-25 is a beta-lactamase. From the Lahey list of VIM beta-lactamases.	38695	VIM-25
ARO:3002296	VIM-26	VIM-26 is a beta-lactamase. From the Lahey list of VIM beta-lactamases.	38696	VIM-26
ARO:3002297	VIM-27	VIM-27 is a beta-lactamase found in Klebsiella pneumoniae.	38697	VIM-27
ARO:3002298	VIM-28	VIM-28 is a beta-lactamase. From the Lahey list of VIM beta-lactamases.	38698	VIM-28
ARO:3002299	VIM-29	VIM-29 is a beta-lactamase found in the Enterobacteriaceae family.	38699	VIM-29
ARO:3002300	VIM-30	VIM-30 is a beta-lactamase found in the Enterobacteriaceae family.	38700	VIM-30
ARO:3002301	VIM-31	VIM-31 is a beta-lactamase found in Enterobacter cloacae.	38701	VIM-31
ARO:3002302	VIM-32	VIM-32 is a beta-lactamase. From the Lahey list of VIM beta-lactamases.	38702	VIM-32
ARO:3002303	VIM-33	VIM-33 is a beta-lactamase found in Klebsiella pneumoniae.	38703	VIM-33
ARO:3002304	VIM-34	VIM-34 is a beta-lactamase found in Klebsiella pneumoniae.	38704	VIM-34
ARO:3002305	VIM-35	VIM-35 is a beta-lactamase. From the Lahey list of VIM beta-lactamases.	38705	VIM-35
ARO:3002306	VIM-36	VIM-36 is a beta-lactamase found in Pseudomonas aeruginosa.	38706	VIM-36
ARO:3002307	VIM-37	VIM-37 is a beta-lactamase found in Pseudomonas aeruginosa.	38707	VIM-37
ARO:3002308	VIM-38	VIM-38 is a beta-lactamase found in Pseudomonas aeruginosa.	38708	VIM-38
ARO:3002309	VIM-39	VIM-39 is a beta-lactamase. From the Lahey list of VIM beta-lactamases.	38709	VIM-39
ARO:3002310	VIM-40	VIM-40 is a beta-lactamase. From the Lahey list of VIM beta-lactamases.	38710	VIM-40
ARO:3002311	VIM-41	VIM-41 is a beta-lactamase. From the Lahey list of VIM beta-lactamases.	38711	VIM-41
ARO:3002312	KPC-2	KPC-2 is a beta-lactamase found in Klebsiella pneumoniae and Pseudomonas aeruginosa.	38712	KPC-2
ARO:3002313	KPC-3	KPC-3 is a beta-lactamase found in Klebsiella pneumoniae.	38713	KPC-3
ARO:3002314	KPC-4	KPC-4 is a beta-lactamase found in Klebsiella pneumoniae.	38714	KPC-4
ARO:3002315	KPC-5	KPC-5 is a beta-lactamase found in Klebsiella pneumoniae and Pseudomonas aeruginosa.	38715	KPC-5
ARO:3002316	KPC-6	KPC-6 is a beta-lactamase found in Klebsiella pneumoniae.	38716	KPC-6
ARO:3002317	KPC-7	KPC-7 is a beta-lactamase found in Klebsiella pneumoniae.	38717	KPC-7
ARO:3002318	KPC-8	KPC-8 is a beta-lactamase found in Klebsiella pneumoniae.	38718	KPC-8
ARO:3002319	KPC-9	KPC-9 is a beta-lactamase found in Klebsiella pneumoniae.	38719	KPC-9
ARO:3002320	KPC-10	KPC-10 is a beta-lactamase found in Klebsiella pneumoniae.	38720	KPC-10
ARO:3002321	KPC-11	KPC-11 is a beta-lactamase found in Klebsiella pneumoniae.	38721	KPC-11
ARO:3002322	KPC-12	KPC-12 is a beta-lactamase. From the Lahey list of KPC beta-lactamases.	38722	KPC-12
ARO:3002323	KPC-13	KPC-13 is a beta-lactamase. From the Lahey list of KPC beta-lactamases.	38723	KPC-13
ARO:3002324	KPC-14	KPC-14 is a beta-lactamase. From the Lahey list of KPC beta-lactamases.	38724	KPC-14
ARO:3002325	KPC-15	KPC-15 is a beta-lactamase. From the Lahey list of KPC beta-lactamases.	38725	KPC-15
ARO:3002326	KPC-16	KPC-16 is a beta-lactamase. From the Lahey list of KPC beta-lactamases.	38726	KPC-16
ARO:3002327	KPC-17	KPC-17 is a beta-lactamase. From the Lahey list of KPC beta-lactamases.	38727	KPC-17
ARO:3002328	KPC-18	KPC-18 is a beta-lactamase. From the Lahey list of KPC beta-lactamases.	38728	KPC-18
ARO:3002329	KPC-19	KPC-19 is a beta-lactamase. From the Lahey list of KPC beta-lactamases.	38729	KPC-19
ARO:3002330	GES-1	GES-1 is a beta-lactamase found in Klebsiella pneumoniae.	38730	GES-1
ARO:3002331	GES-2	GES-2 is a beta-lactamase found in Pseudomonas aeruginosa.	38731	GES-2
ARO:3002332	GES-3	GES-3 is a beta-lactamase found in Klebsiella pneumoniae.	38732	GES-3
ARO:3002333	GES-4	GES-4 is a beta-lactamase found in Klebsiella pneumoniae.	38733	GES-4
ARO:3002334	GES-5	GES-5 is a beta-lactamase found in the Enterobacteriaceae family.	38734	GES-5
ARO:3002335	GES-6	GES-6 is a beta-lactamase found in the Enterobacteriaceae family.	38735	GES-6
ARO:3002336	GES-7	GES-7 is a beta-lactamase found in Enterobacter cloacae.	38736	GES-7
ARO:3002337	GES-8	GES-8 is a beta-lactamase found in Pseudomonas aeruginosa.	38737	GES-8
ARO:3002338	GES-9	GES-9 is a beta-lactamase found in Pseudomonas aeruginosa.	38738	GES-9
ARO:3002339	GES-10	GES-10 is a beta-lactamase. From the Lahey list of GES beta-lactamases.	38739	GES-10
ARO:3002340	GES-11	GES-11 is a beta-lactamase found in Acinetobacter baumannii.	38740	GES-11
ARO:3002341	GES-12	GES-12 is a beta-lactamase found in Acinetobacter baumannii.	38741	GES-12
ARO:3002342	GES-13	GES-13 is a beta-lactamase found in Pseudomonas aeruginosa.	38742	GES-13
ARO:3002343	GES-14	GES-14 is a beta-lactamase found in Acinetobacter baumannii.	38743	GES-14
ARO:3002344	GES-15	GES-15 is a beta-lactamase. From the Lahey list of GES beta-lactamases.	38744	GES-15
ARO:3002345	GES-16	GES-16 is a beta-lactamase. From the Lahey list of GES beta-lactamases.	38745	GES-16
ARO:3002346	GES-17	GES-17 is a beta-lactamase. From the Lahey list of GES beta-lactamases.	38746	GES-17
ARO:3002347	GES-18	GES-18 is a beta-lactamase found in Pseudomonas aeruginosa.	38747	GES-18
ARO:3002348	GES-19	GES-19 is a beta-lactamase found in the Enterobacteriaceae family.	38748	GES-19
ARO:3002349	GES-20	GES-20 is a beta-lactamase found in the Enterobacteriaceae family.	38749	GES-20
ARO:3002350	GES-21	GES-21 is a beta-lactamase. From the Lahey list of GES beta-lactamases.	38750	GES-21
ARO:3002351	GES-22	GES-22 is a beta-lactamase. From the Lahey list of GES beta-lactamases.	38751	GES-22
ARO:3002352	GES-23	GES-23 is a beta-lactamase. From the Lahey list of GES beta-lactamases.	38752	GES-23
ARO:3002353	GES-24	GES-24 is a beta-lactamase. From the Lahey list of GES beta-lactamases.	38753	GES-24
ARO:3002354	NDM-3	NDM-3 is a beta-lactamase found in the Enterobacteriaceae family.	38754	NDM-3
ARO:3002355	NDM-4	NDM-4 is a beta-lactamase found in Escherichia coli.	38755	NDM-4
ARO:3002356	NDM-6	NDM-6 is a beta-lactamase found in the Enterobacteriaceae family.	38756	NDM-6
ARO:3002357	NDM-7	NDM-7 is a beta-lactamase found in Escherichia coli.	38757	NDM-7
ARO:3002358	NDM-8	NDM-8 is a beta-lactamase found in Escherichia coli.	38758	NDM-8
ARO:3002359	NDM-9	NDM-9 is a beta-lactamase found in Klebsiella pneumoniae.	38759	NDM-9
ARO:3002360	NDM-10	NDM-10 is a beta-lactamase. From the Lahey list of NDM beta-lactamases.	38760	NDM-10
ARO:3002361	NDM-11	NDM-11 is a beta-lactamase. From the Lahey list of NDM beta-lactamases.	38761	NDM-11
ARO:3002362	NDM-12	NDM-12 is a beta-lactamase found in Escherichia coli.	38762	NDM-12
ARO:3002363	PER-1	PER-1 is a beta-lactamase found in Pseudomonas aeruginosa.	38763	PER-1
ARO:3002364	PER-2	PER-2 is a beta-lactamase found in Salmonella typhimurium.	38764	PER-2
ARO:3002365	PER-3	PER-3 is a beta-lactamase found in Aeromonas spp.	38765	PER-3
ARO:3002366	PER-4	PER-4 is a beta-lactamase. From the Lahey list of PER beta-lactamases.	38766	PER-4
ARO:3002367	PER-5	PER-5 is a beta-lactamase found in the Enterobacteriaceae family.	38767	PER-5
ARO:3002368	PER-6	PER-6 is a beta-lactamase found in Aeromonas allosaccharophila.	38768	PER-6
ARO:3002369	PER-7	PER-7 is a beta-lactamase found in Acinetobacter baumannii.	38769	PER-7
ARO:3002370	VEB-1	VEB-1 is a beta-lactamase found in Escherichia coli and Pseudomonas aeruginosa.	38770	VEB-1
ARO:3002371	VEB-2	VEB-2 is a beta-lactamase found in Pseudomonas aeruginosa.	38771	VEB-2
ARO:3002372	VEB-3	VEB-3 is a beta-lactamase found in Enterobacter cloacae.	38772	VEB-3
ARO:3002373	VEB-4	VEB-4 is a beta-lactamase found in Proteus mirabilis.	38773	VEB-4
ARO:3002374	VEB-6	VEB-6 is a beta-lactamase found in Proteus mirabilis.	38774	VEB-6
ARO:3002375	VEB-5	VEB-5 is a beta-lactamase. From the Lahey list of VEB beta-lactamases.	38775	VEB-5
ARO:3002376	VEB-7	VEB-7 is a beta-lactamase. From the Lahey list of VEB beta-lactamases.	38776	VEB-7
ARO:3002377	VEB-8	VEB-8 is a beta-lactamase. From the Lahey list of VEB beta-lactamases.	38777	VEB-8
ARO:3002378	VEB-9	VEB-9 is a beta-lactamase. From the Lahey list of VEB beta-lactamases.	38778	VEB-9
ARO:3002379	SME-1	SME-1 is a beta-lactamase found in Serratia marcescens.	38779	SME-1
ARO:3002380	SME-2	SME-2 is a beta-lactamase found in Serratia marcescens.	38780	SME-2
ARO:3002381	SME-3	SME-3 is a beta-lactamase found in Serratia marcescens.	38781	SME-3
ARO:3002382	SME-4	SME-4 is a beta-lactamase. From the Lahey list of SME beta-lactamases.	38782	SME-4
ARO:3002383	SME-5	SME-5 is a beta-lactamase. From the Lahey list of SME beta-lactamases.	38783	SME-5
ARO:3002385	BEL-1	BEL-1 is a beta-lactamase found in Pseudomonas aeruginosa.	38785	BEL-1
ARO:3002386	BEL-2	BEL-2 is a beta-lactamase found in Pseudomonas aeruginosa.	38786	BEL-2
ARO:3002387	BEL-3	BEL-3 is a beta-lactamase found in Pseudomonas aeruginosa.	38787	BEL-3
ARO:3002389	OXY-1-1	OXY-1-1 is a beta-lactamase found in Klebsiella oxytoca.	38789	OXY-1-1
ARO:3002390	OXY-1-2	OXY-1-2 is a beta-lactamase found in Klebsiella oxytoca.	38790	OXY-1-2
ARO:3002391	OXY-1-3	OXY-1-3 is a beta-lactamase found in Klebsiella oxytoca.	38791	OXY-1-3
ARO:3002392	OXY-1-4	OXY-1-4 is a beta-lactamase found in Klebsiella oxytoca.	38792	OXY-1-4
ARO:3002394	OXY-1-6	OXY-1-6 is a beta-lactamase found in Klebsiella oxytoca.	38794	OXY-1-6
ARO:3002396	OXY-2-1	OXY-2-1 is a beta-lactamase found in Klebsiella oxytoca.	38796	OXY-2-1
ARO:3002397	OXY-2-2	OXY-2-2 is a beta-lactamase found in Klebsiella oxytoca.	38797	OXY-2-2
ARO:3002398	OXY-2-3	OXY-2-3 is a beta-lactamase found in Klebsiella oxytoca.	38798	OXY-2-3
ARO:3002399	OXY-2-4	OXY-2-4 is a beta-lactamase found in Klebsiella oxytoca.	38799	OXY-2-4
ARO:3002400	OXY-2-5	OXY-2-5 is a beta-lactamase found in Klebsiella oxytoca.	38800	OXY-2-5
ARO:3002401	OXY-2-6	OXY-2-6 is a beta-lactamase found in Klebsiella oxytoca.	38801	OXY-2-6
ARO:3002402	OXY-2-7	OXY-2-7 is a beta-lactamase found in Klebsiella oxytoca.	38802	OXY-2-7
ARO:3002403	OXY-2-8	OXY-2-8 is a beta-lactamase found in Klebsiella oxytoca.	38803	OXY-2-8
ARO:3002404	OXY-2-9	OXY-2-9 is a beta-lactamase found in Klebsiella oxytoca.	38804	OXY-2-9
ARO:3002405	OXY-2-10	OXY-2-10 is a beta-lactamase. From the Pasteur Institute (Genopole) list of OXY beta-lactamases.	38805	OXY-2-10
ARO:3002406	OXY-2-11	OXY-2-11 is a beta-lactamase. From the Pasteur Institute (Genopole) list of OXY beta-lactamases.	38806	OXY-2-11
ARO:3002407	OXY-2-12	OXY-2-12 is a beta-lactamase. From the Pasteur Institute (Genopole) list of OXY beta-lactamases.	38807	OXY-2-12
ARO:3002408	OXY-2-13	OXY-2-13 is a beta-lactamase. From the Pasteur Institute (Genopole) list of OXY beta-lactamases.	38808	OXY-2-13
ARO:3002409	OXY-3-1	OXY-3-1 is a beta-lactamase found in Klebsiella oxytoca.	38809	OXY-3-1
ARO:3002410	OXY-4-1	OXY-4-1 is a beta-lactamase found in Klebsiella oxytoca.	38810	OXY-4-1
ARO:3002411	OXY-5-1	OXY-5-1 is a beta-lactamase found in Klebsiella oxytoca.	38811	OXY-5-1
ARO:3002412	OXY-5-2	OXY-5-2 is a beta-lactamase found in Klebsiella oxytoca.	38812	OXY-5-2
ARO:3002413	OXY-6-1	OXY-6-1 is a beta-lactamase found in Klebsiella oxytoca.	38813	OXY-6-1
ARO:3002414	OXY-6-2	OXY-6-2 is a beta-lactamase found in Klebsiella oxytoca.	38814	OXY-6-2
ARO:3002415	OXY-6-3	OXY-6-3 is a beta-lactamase found in Klebsiella oxytoca.	38815	OXY-6-3
ARO:3002416	OXY-6-4	OXY-6-4 is a beta-lactamase found in Klebsiella oxytoca.	38816	OXY-6-4
ARO:3002418	OKP-A-1	OKP-A-1 is a beta-lactamase found in Klebsiella pneumoniae.	38818	OKP-A-1
ARO:3002419	OKP-A-2	OKP-A-2 is a beta-lactamase found in Klebsiella pneumoniae.	38819	OKP-A-2
ARO:3002420	OKP-A-3	OKP-A-3 is a beta-lactamase found in Klebsiella pneumoniae.	38820	OKP-A-3
ARO:3002421	OKP-A-4	OKP-A-4 is a beta-lactamase found in Klebsiella pneumoniae.	38821	OKP-A-4
ARO:3002422	OKP-A-5	OKP-A-5 is a beta-lactamase found in Klebsiella pneumoniae.	38822	OKP-A-5
ARO:3002423	OKP-A-6	OKP-A-6 is a beta-lactamase found in Klebsiella pneumoniae.	38823	OKP-A-6
ARO:3002424	OKP-A-7	OKP-A-7 is a beta-lactamase found in Klebsiella pneumoniae.	38824	OKP-A-7
ARO:3002425	OKP-A-8	OKP-A-8 is a beta-lactamase found in Klebsiella pneumoniae.	38825	OKP-A-8
ARO:3002426	OKP-A-9	OKP-A-9 is a beta-lactamase found in Klebsiella pneumoniae.	38826	OKP-A-9
ARO:3002427	OKP-A-10	OKP-A-10 is a beta-lactamase found in Klebsiella pneumoniae.	38827	OKP-A-10
ARO:3002428	OKP-A-11	OKP-A-11 is a beta-lactamase found in Klebsiella pneumoniae.	38828	OKP-A-11
ARO:3002429	OKP-A-12	OKP-A-12 is a beta-lactamase found in Klebsiella pneumoniae.	38829	OKP-A-12
ARO:3002430	OKP-A-13	OKP-A-13 is a beta-lactamase found in Klebsiella pneumoniae.	38830	OKP-A-13
ARO:3002431	OKP-A-14	OKP-A-14 is a beta-lactamase found in Klebsiella pneumoniae.	38831	OKP-A-14
ARO:3002432	OKP-A-15	OKP-A-15 is a beta-lactamase found in Klebsiella pneumoniae.	38832	OKP-A-15
ARO:3002433	OKP-A-16	OKP-A-16 is a beta-lactamase found in Klebsiella pneumoniae.	38833	OKP-A-16
ARO:3002434	OKP-B-1	OKP-B-1 is a beta-lactamase found in Klebsiella pneumoniae.	38834	OKP-B-1
ARO:3002435	OKP-B-2	OKP-B-2 is a beta-lactamase found in Klebsiella pneumoniae.	38835	OKP-B-2
ARO:3002436	OKP-B-3	OKP-B-3 is a beta-lactamase found in Klebsiella pneumoniae.	38836	OKP-B-3
ARO:3002437	OKP-B-4	OKP-B-4 is a beta-lactamase found in Klebsiella pneumoniae.	38837	OKP-B-4
ARO:3002438	OKP-B-5	OKP-B-5 is a beta-lactamase found in Klebsiella pneumoniae.	38838	OKP-B-5
ARO:3002439	OKP-B-6	OKP-B-6 is a beta-lactamase found in Klebsiella pneumoniae.	38839	OKP-B-6
ARO:3002440	OKP-B-7	OKP-B-7 is a beta-lactamase found in Klebsiella pneumoniae.	38840	OKP-B-7
ARO:3002441	OKP-B-8	OKP-B-8 is a beta-lactamase found in Klebsiella pneumoniae.	38841	OKP-B-8
ARO:3002442	OKP-B-9	OKP-B-9 is a beta-lactamase found in Klebsiella pneumoniae.	38842	OKP-B-9
ARO:3002443	OKP-B-10	OKP-B-10 is a beta-lactamase found in Klebsiella pneumoniae.	38843	OKP-B-10
ARO:3002444	OKP-B-11	OKP-B-11 is a beta-lactamase found in Klebsiella pneumoniae.	38844	OKP-B-11
ARO:3002445	OKP-B-12	OKP-B-12 is a beta-lactamase found in Klebsiella pneumoniae.	38845	OKP-B-12
ARO:3002446	OKP-B-13	OKP-B-13 is a beta-lactamase found in Klebsiella pneumoniae.	38846	OKP-B-13
ARO:3002450	OKP-B-17	OKP-B-17 is a beta-lactamase found in Klebsiella pneumoniae.	38850	OKP-B-17
ARO:3002451	OKP-B-18	OKP-B-18 is a beta-lactamase found in Klebsiella pneumoniae.	38851	OKP-B-18
ARO:3002452	OKP-B-19	OKP-B-19 is a beta-lactamase found in Klebsiella pneumoniae.	38852	OKP-B-19
ARO:3002453	OKP-B-20	OKP-B-20 is a beta-lactamase found in Klebsiella pneumoniae.	38853	OKP-B-20
ARO:3002454	LEN-1	LEN-1 is a beta-lactamase found in Klebsiella pneumoniae.	38854	LEN-1
ARO:3002455	LEN-2	LEN-2 is a beta-lactamase found in Klebsiella pneumoniae.	38855	LEN-2
ARO:3002456	LEN-5	LEN-5 is a beta-lactamase found in Klebsiella pneumoniae.	38856	LEN-5
ARO:3002457	LEN-7	LEN-7 is a beta-lactamase found in Klebsiella pneumoniae.	38857	LEN-7
ARO:3002458	LEN-8	LEN-8 is a beta-lactamase found in Klebsiella pneumoniae.	38858	LEN-8
ARO:3002459	LEN-9	LEN-9 is a beta-lactamase found in Klebsiella pneumoniae.	38859	LEN-9
ARO:3002460	LEN-10	LEN-10 is a beta-lactamase found in Klebsiella pneumoniae.	38860	LEN-10
ARO:3002461	LEN-11	LEN-11 is a beta-lactamase found in Klebsiella pneumoniae.	38861	LEN-11
ARO:3002462	LEN-12	LEN-12 is a beta-lactamase found in Klebsiella pneumoniae.	38862	LEN-12
ARO:3002463	LEN-13	LEN-13 is a beta-lactamase found in Klebsiella pneumoniae and Klebsiella variicola.	38863	LEN-13
ARO:3002464	LEN-16	LEN-16 is a beta-lactamase found in Klebsiella pneumoniae.	38864	LEN-16
ARO:3002465	LEN-18	LEN-18 is a beta-lactamase found in Klebsiella pneumoniae.	38865	LEN-18
ARO:3002466	LEN-19	LEN-19 is a beta-lactamase found in Klebsiella pneumoniae.	38866	LEN-19
ARO:3002467	LEN-20	LEN-20 is a beta-lactamase found in Klebsiella pneumoniae.	38867	LEN-20
ARO:3002468	LEN-21	LEN-21 is a beta-lactamase found in Klebsiella pneumoniae.	38868	LEN-21
ARO:3002469	LEN-22	LEN-22 is a beta-lactamase found in Klebsiella pneumoniae.	38869	LEN-22
ARO:3002470	LEN-23	LEN-23 is a beta-lactamase found in Klebsiella pneumoniae.	38870	LEN-23
ARO:3002471	LEN-24	LEN-24 is a beta-lactamase found in Klebsiella pneumoniae.	38871	LEN-24
ARO:3002472	LEN-4	LEN-4 is a beta-lactamase found in Escherichia coli.	38872	LEN-4
ARO:3002473	LEN-17	LEN-17 is a beta-lactamase found in Escherichia coli.	38873	LEN-17
ARO:3002474	LEN-26	LEN-26 is a beta-lactamase found in Escherichia coli and Klebsiella pneumoniae.	38874	LEN-26
ARO:3002475	LEN-3	LEN-3 is a beta-lactamase. From the Pasteur Institute list of LEN beta-lactamases.	38875	LEN-3
ARO:3002476	LEN-6	LEN-6 is a beta-lactamase. From the Pasteur Institute list of LEN beta-lactamases.	38876	LEN-6
ARO:3002477	LEN-14	LEN-14 is a beta-lactamase. From the Pasteur Institute list of LEN beta-lactamases.	38877	LEN-14
ARO:3002478	LEN-15	LEN-15 is a beta-lactamase. From the Pasteur Institute list of LEN beta-lactamases.	38878	LEN-15
ARO:3002479	LEN-25	LEN-25 is a beta-lactamase. From the Pasteur Institute list of LEN beta-lactamases.	38879	LEN-25
ARO:3002480	OXA-144	OXA-144 is a beta-lactamase found in Pseudomonas aeruginosa.	38880	OXA-144
ARO:3002481	AER-1	AER-1 is a beta-lactamase found in Aeromonas hydrophila.	38881	AER-1
ARO:3002482	LRA-1	LRA-1 is a beta-lactamase isolated from soil samples in Alaska.	38882	LRA-1
